{
  "$schema": "./schemas/hosting-catalog.schema.json",

  "catalog": {
    "id": "legacy-hosting",
    "name": "Legacy Hosting",
    "brand": "Maleng Legacy",
    "version": "2026.1.0",
    "currency": "ZAR",
    "country": "ZA",
    "locale": "en-ZA",
    "tax": {
      "enabled": true,
      "displayMode": "inclusive",
      "rate": 0.15
    }
  },

  "platform": {
    "storefront": "https://hosting.malenglegacy.co.za",
    "portal": "https://cloud.malenglegacy.co.za",
    "corporate": "https://tech.malenglegacy.co.za",
    "api": "https://api.hosting.malenglegacy.co.za"
  },

  "categories": [
    {
      "id": "domains",
      "name": "Domains",
      "slug": "domains",
      "description": "Register, transfer, renew and manage your domains.",
      "icon": "globe",
      "displayOrder": 1,
      "status": "active"
    },
    {
      "id": "web-hosting",
      "name": "Web Hosting",
      "slug": "web-hosting",
      "description": "Fast and reliable hosting for websites and applications.",
      "icon": "server",
      "displayOrder": 2,
      "status": "active"
    },
    {
      "id": "cloud-vps",
      "name": "Cloud VPS",
      "slug": "cloud-vps",
      "description": "Scalable virtual servers for developers, businesses and applications.",
      "icon": "cloud",
      "displayOrder": 3,
      "status": "active"
    },
    {
      "id": "dedicated-servers",
      "name": "Dedicated Servers",
      "slug": "dedicated-servers",
      "description": "Dedicated bare-metal infrastructure for demanding workloads.",
      "icon": "database",
      "displayOrder": 4,
      "status": "draft"
    },
    {
      "id": "email",
      "name": "Email Solutions",
      "slug": "email",
      "description": "Professional and business-grade email infrastructure.",
      "icon": "mail",
      "displayOrder": 5,
      "status": "active"
    },
    {
      "id": "infrastructure",
      "name": "Infrastructure",
      "slug": "infrastructure",
      "description": "Storage, backup, networking and security infrastructure.",
      "icon": "network",
      "displayOrder": 6,
      "status": "active"
    }
  ],

  "products": [
    {
      "id": "domain-coza",
      "category": "domains",
      "type": "domain",
      "name": ".co.za Domain",
      "slug": "co-za",
      "tld": ".co.za",
      "description": "Register your South African domain with Legacy Hosting. Includes DNS management and free transfer in.",
      "marketing": {
        "label": "South Africa",
        "badge": "Most Popular",
        "featured": true,
        "displayOrder": 1
      },
      "pricing": {
        "currency": "ZAR",
        "registration": 149,
        "transfer": 149,
        "renewal": 149
      },
      "billing": {
        "period": "year",
        "autoRenew": true,
        "engine": "fossbilling",
        "mapping": {
          "productType": "domain",
          "externalProductId": "LEGACY-DOM-COZA"
        }
      },
      "operations": {
        "availabilityCheck": true,
        "registration": true,
        "transfer": true,
        "renewal": true,
        "dnsManagement": true
      },
      "requirements": {
        "authCodeForTransfer": true
      },
      "providerStrategy": {
        "type": "router",
        "eligibleProviders": ["namecom"]
      },
      "portal": { "dns": true },
      "status": "active"
    },
    {
      "id": "domain-com",
      "category": "domains",
      "type": "domain",
      "name": ".com Domain",
      "slug": "com",
      "tld": ".com",
      "description": "Global .com domain registration and management.",
      "marketing": {
        "label": "Global",
        "featured": true,
        "displayOrder": 2
      },
      "pricing": {
        "currency": "ZAR",
        "registration": 249,
        "transfer": 249,
        "renewal": 249
      },
      "billing": {
        "period": "year",
        "autoRenew": true,
        "engine": "fossbilling",
        "mapping": {
          "productType": "domain",
          "externalProductId": "LEGACY-DOM-COM"
        }
      },
      "operations": {
        "availabilityCheck": true,
        "registration": true,
        "transfer": true,
        "renewal": true,
        "dnsManagement": true
      },
      "requirements": {
        "authCodeForTransfer": true
      },
      "providerStrategy": {
        "type": "router",
        "eligibleProviders": ["namecom"]
      },
      "portal": { "dns": true },
      "status": "active"
    },
    {
      "id": "domain-net",
      "category": "domains",
      "type": "domain",
      "name": ".net Domain",
      "slug": "net",
      "tld": ".net",
      "description": "Classic .net domain for networks and technology brands.",
      "pricing": {
        "currency": "ZAR",
        "registration": 269,
        "transfer": 269,
        "renewal": 269
      },
      "billing": {
        "period": "year",
        "autoRenew": true,
        "engine": "fossbilling",
        "mapping": {
          "productType": "domain",
          "externalProductId": "LEGACY-DOM-NET"
        }
      },
      "operations": {
        "availabilityCheck": true,
        "registration": true,
        "transfer": true,
        "renewal": true,
        "dnsManagement": true
      },
      "requirements": {
        "authCodeForTransfer": true
      },
      "providerStrategy": {
        "type": "router",
        "eligibleProviders": ["namecom"]
      },
      "status": "active"
    },
    {
      "id": "shared-starter",
      "category": "web-hosting",
      "type": "shared-hosting",
      "name": "Starter",
      "slug": "starter",
      "description": "Perfect for personal sites, blogs and small projects.",
      "marketing": {
        "label": "Entry",
        "displayOrder": 1
      },
      "pricing": {
        "currency": "ZAR",
        "monthly": 79,
        "annual": 790
      },
      "billing": {
        "cycle": ["monthly", "annual"],
        "autoRenew": true,
        "engine": "fossbilling",
        "mapping": {
          "productType": "hosting",
          "externalProductId": "LEGACY-HOST-STARTER"
        }
      },
      "resources": {
        "storageGB": 10,
        "websites": 1,
        "databases": 2,
        "mailboxes": 5
      },
      "features": [
        "NVMe storage",
        "Free SSL",
        "DNS management",
        "Daily backups",
        "Email hosting"
      ],
      "controlPanel": "hestia",
      "providerStrategy": {
        "type": "router",
        "eligibleProviders": ["hostafrica", "africanhost"]
      },
      "portal": { "backups": true, "dns": true },
      "status": "active"
    },
    {
      "id": "business-pro",
      "category": "web-hosting",
      "type": "shared-hosting",
      "name": "Business Pro",
      "slug": "business-pro",
      "description": "Reliable hosting for growing businesses and agencies.",
      "marketing": {
        "label": "Most Popular",
        "badge": "Best Value",
        "featured": true,
        "displayOrder": 2
      },
      "pricing": {
        "currency": "ZAR",
        "monthly": 149,
        "annual": 1490
      },
      "billing": {
        "cycle": ["monthly", "annual"],
        "autoRenew": true,
        "engine": "fossbilling",
        "mapping": {
          "productType": "hosting",
          "externalProductId": "LEGACY-HOST-BUSINESS-PRO"
        }
      },
      "resources": {
        "storageGB": 25,
        "websites": 5,
        "databases": 10,
        "mailboxes": 25
      },
      "features": [
        "NVMe storage",
        "Free SSL",
        "DNS management",
        "Daily backups",
        "Email hosting",
        "Control panel",
        "Staging environments"
      ],
      "controlPanel": "cpanel",
      "providerStrategy": {
        "type": "router",
        "eligibleProviders": ["hostafrica", "africanhost"]
      },
      "portal": { "backups": true, "dns": true },
      "status": "active"
    },
    {
      "id": "managed-wordpress",
      "category": "web-hosting",
      "type": "managed-wordpress",
      "name": "Managed WordPress",
      "slug": "managed-wordpress",
      "description": "Optimised WordPress hosting with automatic updates, security and performance.",
      "marketing": {
        "label": "WordPress",
        "badge": "Recommended",
        "featured": true,
        "displayOrder": 3
      },
      "pricing": {
        "currency": "ZAR",
        "monthly": 249,
        "annual": 2490
      },
      "billing": {
        "cycle": ["monthly", "annual"],
        "autoRenew": true,
        "engine": "fossbilling",
        "mapping": {
          "productType": "hosting",
          "externalProductId": "LEGACY-HOST-WP"
        }
      },
      "resources": {
        "storageGB": 40,
        "websites": 3,
        "databases": 10,
        "mailboxes": 15
      },
      "features": [
        "NVMe storage",
        "Free SSL",
        "Automatic WordPress updates",
        "Daily backups",
        "Malware scanning",
        "Staging",
        "CDN ready"
      ],
      "controlPanel": "cpanel",
      "providerStrategy": {
        "type": "router",
        "eligibleProviders": ["hostafrica"]
      },
      "status": "active"
    },
    {
      "id": "vps-1",
      "category": "cloud-vps",
      "type": "vps",
      "name": "Legacy VPS 1",
      "slug": "vps-1",
      "description": "Entry-level cloud server ideal for development, small applications and staging environments.",
      "marketing": {
        "label": "Entry Cloud",
        "badge": "Best for developers",
        "featured": false,
        "displayOrder": 1
      },
      "resources": {
        "vcpu": 2,
        "ramGB": 4,
        "storage": { "sizeGB": 80, "type": "NVMe" },
        "traffic": { "includedTB": 4 },
        "ipv4": 1,
        "ipv6": true
      },
      "pricing": {
        "currency": "ZAR",
        "monthly": 199,
        "annual": 2149
      },
      "billing": {
        "cycle": ["monthly", "annual"],
        "autoRenew": true,